,Label ID,Label,Notes
939,1,Negative ID,"Found dead in our wood pile.  Wood pile is two weeks old and while moving the pile to stack it, this guy was found dead on top of a piece of wood. Hornet is intact, and I find it hard to believe that it would have been moved with the pile."
940,1,Negative ID,Two large Mostly black wasps either mating or one is attacking the other.
941,1,Negative ID,Found a dead hornet in my fly trap that appears similar to the giant Asian hornet. My kids think they saw a live one flying in our pasture.
942,1,Negative ID,"Saw a possible hornets, they look like the picture I sent."
943,1,Negative ID,Was moving a fallen tree and found this floundering underneath a round
944,1,Negative ID, 
945,1,Negative ID,"Going in my wood pile, husband killed didn't see any more"
946,1,Negative ID,Murder Hornet? Large hornet-looking creature came into backyard garden area. Usual bees seemed agitated. I have never seen this creature before.
947,1,Negative ID,We don't think this is an Asian Hornet but it's big so thought we'd report it. If it's not would you please tell us what it is. Thanks
948,1,Negative ID,"My kitty cat got this one.  It’s about 2 inches long, yellow face, large black eyes, two color stinger - Black toward the tip and orange toward the belly.  Not seen this before, does not match photos of the murder hornet."
949,1,Negative ID,Came to visit parents noticed a colony of these insects swarming their garden. They are not aggressive but are making honeycombs through out the property.
950,1,Negative ID,Found on milkman road. Langley washington
951,1,Negative ID, 
952,1,Negative ID,Large two and a half inches long stinger
953,1,Negative ID,"Not sure what this one is, just on case..."
954,1,Negative ID,"my driveway is full of huge hornets that appear to have yellow faces, they have numerous holes dug in my gravel driveway and are around 2 inches long. Please let me know if the state wants to check them out or if I should spray them with hornet spray. Th"
955,1,Negative ID,We kill 3 of the wasps pictured. 2 immediately aft cutting a tre down and one a couple days later. They acted lethargic.
956,1,Negative ID,Found the cats playing with it outdoor. It was hardly flying
957,1,Negative ID, 
958,1,Negative ID,"Flew over us for dinner. Kind of long and blackish. Killed it with Home Depot yellowjacket spray, which made it turn quite black."
959,1,Negative ID,found in kent wa on side of road
960,1,Negative ID,Working in the back area of my yard nd saw it on the ground.
961,1,Negative ID,"It looked like a large hornet, I tried to measure by my phone and compared it to a small leaf it was about 1 1/2 inches. Our neighbors have 4 honey bee boxes in their backyard"
962,1,Negative ID,"I found this in a large yellow dahlia, just as I cut the flower stem.  I got it into a jar so I could take some photos and find out what it was.  It seemed to have an aggressive attitude when I was trying to get it into the jar."
963,1,Negative ID,"Black face, one yellow marking between head and tail end, brown and black tail, yellow tips on the antenna and yellow on the legs, no hair on the tail"
964,1,Negative ID,I tried to upload a video of a possible sighting in Seattle but don't think it uploaded so I'm sending a screenshot. Please let me know if you'd like the video
965,1,Negative ID,Dive-bombed us in our pool. Hit it with a water noodle. Please let us know if it is a Murder Hornet or not.
966,1,Negative ID,"Road trip from Spokane, WA to Florence, OR. Upon arrival, specimen was stuck in the grille of my camper van. Specimen has only partial thorax."
967,1,Negative ID, 
968,1,Negative ID, 
969,1,Negative ID,"I'm a gardener, never seen this size before so I'm guessing it's the bad one."
970,1,Negative ID,Found inside my house
971,1,Negative ID,An employee turned this in on July 27th.
972,1,Negative ID,"This bee was found in Ephrata, WA. It was flying around near my son on our deck. I hit it with my shoe. I don’t know if it was a murder hornet or not. It was big."
973,1,Negative ID,"I sent a picture of a live hornet today, my sister came and killed it so here's more pictures"
974,1,Negative ID, 
975,1,Negative ID,"Dead, by my house. Have seen others at Ebeys landing"
976,1,Negative ID, 
977,1,Negative ID,"Saw a large wasp, likely 2 inches long... maybe a bit bigger."
978,1,Negative ID,"Not sure if this is one, but it was very large, over an inch and out of the ordinary in our yard which usually has tons of bees and wasps."
979,1,Negative ID,"Found around nearby tree by our house, 2 inches long and has a really long stinger"
980,1,Negative ID,found at my home on my sidewalk
981,1,Negative ID,I don’t know how big those hornets get but added the lead to try to have size comparison for you. I was walking dog so didn’t have anything to put it in.
982,1,Negative ID,"Found this crawling on some ground cover flowers. Not sure what kind it is, but I have never see one like it, or this big. About one and a third inches long"
983,1,Negative ID,Found in Almira WA. Not sure if it is one. Pictures attached
984,1,Negative ID,Our son was helping our neighbor with yard work when he heard this bee.  Sorry its decapitated but both pieces are in the picture.
985,1,Negative ID,Beachgoer saw activity in dry grassy area. Found 4 holes with active bees/hornets going in and out. Very active and flying nearby too. Each was about 1.5 or more inches in length.
986,1,Negative ID,Found dead wasp in the back of my house. Not like any wasp I’ve seen around my house and my neighbors also raise honey bees.
987,1,Negative ID,Big ass bee the past few days
988,1,Negative ID,Saw it laying in yard. Put it in a jar. About 1 inch long
989,1,Negative ID, 
990,1,Negative ID,"Spotted on broad st, just east of Elliott Ave. very large, at least 1-2” long. Possibly a golden digger wasp but didn’t want to take any chances"
991,1,Negative ID,"I saw this on my mint plant in my backyard. It was much larger than the bees that were on the mint. I don't remember the head being orange, it is hard to see in the pictures. It was larger than a yellow jacket. Our neighbors have 3 bee hives and have not"
992,1,Negative ID,In my car window still alive in a bottle now please call ASAP
993,1,Negative ID,Call me ASAP still alive
994,1,Negative ID,"GPS on photo, looks like 3 holes in ground. About 1.5 to 2 inches"
995,1,Negative ID,Giant bees dipping holes in the dry dirt
996,1,Negative ID,Found large hornet alive on my property trapped it in a jar.
997,1,Negative ID, 
998,1,Negative ID,This insect is trapped in a wasp trap and appears similar to the Asian Giant Hornet. We have also had unusually low numbers of yellowjackets and honey bees this season.
999,1,Negative ID,Huge wasp with large mandibles
1000,1,Negative ID,I saw one dead on the ground and one alive flying around. There were also what I believe yellow jackets flying around in the same area
1001,1,Negative ID,I saw them on blackberry bushes.  There were 4-5 working over the black berries
1002,1,Negative ID,bizarre aggressive very large wasp I've never seen before
1003,1,Negative ID,photos taken from inside the cab of a Toyota Tacoma. The pic of the rear view mirror indicates the size of the insect.
1004,1,Negative ID, 
1005,1,Negative ID,Lake Meridian Park - seen digging underground
1006,1,Negative ID,Found dead on driveway
1007,1,Negative ID,I live on Totten Inlet near Shelton.
1008,1,Negative ID,"Location: Downtown Seattle near Pike Place Market on residential condo rooftop. Approx 1.5"" long. After doing some research, this is probably a Golden Digger Hornet (?) but I had NEVER seen anything like it. It was not aggressive towards the other bees."
1009,1,Negative ID,"I am not sure if this is one, but I have never seen a bee like this."
1010,1,Negative ID,Large bee
1011,1,Negative ID,Came out of woodpile
1012,1,Negative ID,Back yard. Larger than normal population for body size. One photo has tape measure beneath jar
1013,1,Negative ID,"Found in window screen track on 3 windows.  Big cocoons, with empty wasp husks, and dead green crickets stuffed in the hay/dried grasses.  I am assuming for new hatchlings food.  Yuk!for"
1014,1,Negative ID,What appears toBe a dead Murder Hornet on my sisters patio @ 18322 12th NE.
1015,1,Negative ID,"In ground hive on south side of property behind boat trailers, near where photo was taken which had lots more climbing in and flying out."
1016,1,Negative ID,Flying in yard going flower to flower
1017,1,Negative ID,"Noticed it walking through the grass next to my driveway in Everett, WA"
1018,1,Negative ID,Found dead on our porch. Picked up in a container.
1019,1,Negative ID,The hornet has spent over 5 minutes on our Allium flowers.
1020,1,Negative ID,Think i caught one. Its alive now.
1021,1,Negative ID,Twitching on ground
1022,1,Negative ID,It is a murder hornet found in my front yard in Spokane wa by my kids pool while we were playing out side now that hornet is in my freezer.
1023,1,Negative ID,"Please let me know if this is an Asian hornet or a wasp, thank you."
1024,1,Negative ID,"While docking my kayak I heard a loud buzz and then saw this flying at me.  I swat it with my hat.  I tried to step on it and it still didn't die.  I trapped it with a rock and got a pair of pliers, it tried to sting and pinch the pliers.  It wasn't unti"
1025,1,Negative ID, 
1026,1,Negative ID, 
1027,1,Negative ID,"Big hornet many yellow lines, 1,5”, fat, big front legs"
1028,1,Negative ID,"It is about 1.5 inches long.  I have it in a jar.  It was big and aggressive, but I'm not sure it's a murder hornet."
1029,1,Negative ID,Saw what we thought may have been a murder hornet.  Feel free to contact me
1030,1,Negative ID,Found this wasp dead in my yard this morning.
1031,1,Negative ID,Saw three this morning on my flowering leeks
1032,1,Negative ID,"We found this nearly dead specimen on the beach in Port Townsend. It was roughly 1.5"" in length - another beach comber bagged it to send in. I thought I would also send this image."
1033,1,Negative ID,"landed on deck and killed it.  Not sure if this is one of the murder hornets, but biggest bee looking creature we've ever seen"
1034,1,Negative ID,Extremely aggressive it did not like me taking a picture of it and came after me I thankfully did not get stung we were camping at baker lake in Concrete Wa
1035,1,Negative ID,No idea if this is a giant hornet but the stinger and size is very abnormal.
1036,1,Negative ID, 
1037,1,Negative ID,"Found in Finn Hill, Washington"
1038,1,Negative ID,My husband found dead you can contact him at 509-531-5827 (Donnie) if this is considered to maybe be the species your looking for
1039,1,Negative ID, 
1040,1,Negative ID,"Two days ago, I reported seeing to full size .  Today there were 2 half size - makes  wonder if there is a hive in the area"
1041,1,Negative ID,We have caught a murder hornet it is still alive what do we do?
1042,1,Negative ID, 
1043,1,Negative ID,"I have more pictures of the murder hornet but it will only let me upload the one, if you’d like more please shoot me an email and I’ll get them to you. I have seen a murder hornet on THREE separate occasions. One at beaver bay campground outside of c"
1044,1,Negative ID, 
1045,1,Negative ID,Found swimming in my dogs kiddie pool. Trapped in a lidded jar where it is dying.
1046,1,Negative ID,"This was flying around our worksite.  We stepped on it then took the attached photo.  This was in Kent, WA"
1047,1,Negative ID,One inch .mutipless.attacking eachother.pond neat
1048,1,Negative ID,Entering and exiting hole at base of rock wall
1049,1,Negative ID,A bunch are buzzing around the blackberry bush in our backyard
1050,1,Negative ID,Multiple large bees the past week
1051,1,Negative ID,I began seeing a new insect this year
1052,1,Negative ID,Could not get a decent picture as it was on the other side of the screen window
1053,1,Negative ID,"Likes the blossoms of butterfly weed. Had 8 on one small bush today. I would describe it as having a black head, golden brown slightly fuzzy body, and thorax that is vivid orange on front half and black on back half.  They are twice the length of a yello"
1054,1,Negative ID,"Observed 2 inch plus hornet on my limelight hydrangea flowers.  A typical honeybee landed on top of the hornet, in a way that made us assume the honey bee was attacking this hornet, and the honeybee was 1/4 - 1/3 the size of this hornet.  I immediately r"
1055,1,Negative ID,"We have several dozen of these in our yard. They disappear into small holes in the ground. They are about 1.5 inches in size. Don't appear to be the Asian killer hornet, but seems rare. Wondering whether we should be worried. We have small dogs in the ya"
1056,1,Negative ID,Not positive if it's the right species.
1057,1,Negative ID, 
1058,1,Negative ID,In my yard on the peppermint plants
1059,1,Negative ID,We just noticed this suspected hornet outside our bedroom window on the second floor at 10:30pm. It was trying to enter the room and likely was attracted by light. We also have more pics and videos.
1060,1,Negative ID,"The video I attached is very hard to see clearly but I am certain this was the murder hornet because I was working at a clients house doing tree removals in Gig harbor, WA when I saw the murder hornet that was right in front of me and my worker and it fl"
1061,1,Negative ID,It is on my front porch. It is trapped using a glass cup.
1062,1,Negative ID,Came into my bathroom
1063,1,Negative ID,Found dead in a swimming pool in the morning
1064,1,Negative ID, 
1065,1,Negative ID, 
1066,1,Negative ID,About 1.5
1067,1,Negative ID,They are all over the entire park
1068,1,Negative ID,"Underground nest on school yard next to covered basketball court, large 1 inch+ long hornets"
1069,1,Negative ID,"was seen carrying large grasshopper in the air and was able to snap some blurry photos from far away, I had no intentions of being stung."
1070,1,Negative ID,In Snoqualmie in back of our house - on the Snoqualmie Ridge Golf Course - 4th hole
1071,1,Negative ID,"Looked like a very large bee or hornet  - more than 1 inch long. Had a large stinger on its tail. Sighted flying around my house. Landed on a tree. I swprayed it with RAID, but by the time it I got back with a container to try to get the thing, it was go"
1072,1,Negative ID,Digging in sand on Whidbey Island
1073,1,Negative ID,I saw this at my house in Vancouver Wa (98663) and am 99% sure it was one due to the size and orange head. I couldn’t get a pick as they would fly towards me when I got close. We think we killed one (sprayed with carb cleaner) and then put granulated c
1074,1,Negative ID,"saw several in various ""larger"" sizes aggressively swarming around other bees in my yard"
1075,1,Negative ID, 
1076,1,Negative ID,Notice couple dead ones on ground started looking around an notice a BUNCH flying around in tree
1077,1,Negative ID,"I have a video, a very poor quality photo that's attached.  They are about 1.5"" in length, saw three of them chasing away other bees and fed on flowers.  I first notice them when they buzzed and tapped on my window attempting to fly into the house. very"
1078,1,Negative ID,7-Aug-20
1079,1,Negative ID, 
1080,1,Negative ID,"Not a murder hornet. A decapitated wasp, but I didn't know if I should report that just in case it was caused by a Murder Hornet.."
1081,1,Negative ID,This was in Yakima WA At Borton Fruit
1082,1,Negative ID,I work on a legal Mariuana farm and it was sitting on a marijuana plant. It’s bigger than eat the picture makes it look
1083,1,Negative ID,"Was a little over an inch long clinging to the window glass. I'm allergic to bees so I didn't get a good picture of the top, just the underside"
1084,1,Negative ID,Rehabbing an old house on mercer island with a pretty lush backyard that’s been I disturbed. I noticed this 1.5 inch bee and thought about my kids.
1085,1,Negative ID,"While camping at Sun Lakes north loop, we noticed 2 hornets and I captured one on a solo cup."
1086,1,Negative ID,we have nests in the ground all over our apt complex.
1087,1,Negative ID, 
1088,1,Negative ID,Single insect in our garden
1089,1,Negative ID,Bellingham marine park fairhaven
1090,1,Negative ID, 
1091,1,Negative ID, 
1092,1,Negative ID,"we realize this is not a murder hornet, but have never seen a hornet this large. We live very close to the WSU agriculture department in Puyallup and thought we should report it. Thanks."
1093,1,Negative ID, 
1094,1,Negative ID, 
1095,1,Negative ID,"Roughly 2 inches long and in this photo, it is eating a bee. The bee is at the bottom with its legs sticking up."
1096,1,Negative ID,It was in our back yard on our Oregano pot
1097,1,Negative ID,Huge bee with a huge stinger
1098,1,Negative ID,burrows -- don't know if it's the right species; I hope not!
1099,1,Negative ID,"About 1.5in long. Just west of Boardman OR, On the shore of the Columbia river. One of the pictures was from it floating in the water after we swiped it off our infant."
1100,1,Negative ID,Doubt this is one but it’s big so here it is
1101,1,Negative ID,Found at Seacrest Park cove 1 next to Saltys on alki
1102,1,Negative ID,Part yellow with black and more orange; unsure if it had broken wing
1103,1,Negative ID,We routinely see 3-4 and always on this hydrangea flowering plant
1104,1,Negative ID,"Black body, head and wings. Yellow stripes on antennae and legs. Found on my driveway just south of Cougar Mountain Regional Wildlife Park in King County, WA"
1105,1,Negative ID,Might have one in a jar that I found in garden
1106,1,Negative ID,In mint plant
1107,1,Negative ID, 
1108,1,Negative ID,Found in front yard
1109,1,Negative ID,Discovered on property.  Sure this is an Asian Hornet
1110,1,Negative ID,I have one captured. There are quite a few that seem to be burrowing into the ground or raiding something else living there.
1111,1,Negative ID,Saw this hovering very low over the ground in my backyard. Shot with my hose and killed it. Captured it and holding it at my home if it’s of value
1112,1,Negative ID,From pictures ive looked at it probably isnt one of the hornets but fairly big and havent seen one before.
1113,1,Negative ID, 
1114,1,Negative ID,I have seen more than one of these in the bushes in my front yard!
1115,1,Negative ID,In hops.
1116,1,Negative ID,"Very big. On our flowers, we cut the flower off into a pot and the hornet is now trapped. duct tape over lid."
1117,1,Negative ID,Ground burrowing
1118,1,Negative ID,"Large 1.5 +inches with very long black stinger and orange head coloring walking around on door screen. Pic taken from inside house. Hornet, & stinger, so large I called dog in from court yard from a different door. When I got back, hornet was gone."
1119,1,Negative ID,"Caught alive, frozen to keep intact and report"
1120,1,Negative ID,It is now dead. Held in jar
1121,1,Negative ID,Today in Coulee City.
1122,1,Negative ID,It was really big and kept flying at my hysband
1123,1,Negative ID,"It flew into our windshield while driving. Not sure it's a murder hornet but was about 1"" long plus stinger with similar markings."
1124,1,Negative ID,"Have found 2 at my house in the past 2 yrs. One found in pool 2 yrs ago, one hit my truck 2 weeks ago"
1125,1,Negative ID,Large wasp found on wine tank pad
1126,1,Negative ID,Captured possible Live murder hornet
1127,1,Negative ID,"I was walking my dogs in Shoreline, Washington and saw this. I couldn’t see the face of it and didn’t want to get too close. It was at least an inch 1/4 long."
1128,1,Negative ID,"Found in recent fallen timber.  Bee was over 2"" long with long stinger, and was killed."
1129,1,Negative ID,Notice couple dead ones on ground started looking around seen a BUNCH flying around in tree
1130,1,Negative ID,Trail behind Haggens grocery.This morning on my trail walk I spotted and photographed and dead hornet.
1131,1,Negative ID,"Much larger than other bees in garden, likes mint flowers"
1132,1,Negative ID,"Found at least 10 while picking blackberries on 184th Ave Se, Issaquah between 4210 & 4204. They were flying around & digging in dirt."
1133,1,Negative ID,Seen in Fairwood/Renton
1134,1,Negative ID,I think this is actually an elm saw fly but I wanted to make sure.
1135,1,Negative ID,It was on my car window at Mukilteo City Hall. I almost had a panic attack. It was at least 2 inches long.
1136,1,Negative ID,New pollinator to the farm
1137,1,Negative ID,Kids spotted large insect flying around with very long stinger.  My husband killed it.  We really aren't sure it is an Asian giant hornet.  Attached is a photo.
1138,1,Negative ID, 
1139,1,Negative ID,"Very large hornet, came out of hole in the ground, orange stripe on it"
1140,1,Negative ID,It landed in our blue umbrella.  I have an app on my phone that identifies insects.  This picture is zoomed in because I didn't want to get too close to it.  I have never seen one before.
1141,1,Negative ID, 
1142,1,Negative ID,caught in spiderweb on the garage door.
1143,1,Negative ID, 
1144,1,Negative ID,"I don’t believe this is a murder hornet but just in case I’m sending it.  If not, could you identify it for me?"
1145,1,Negative ID,I have a live specimen. No response since this morning. Do I just let it go?
1146,1,Negative ID,Captured in garage this morning. Very angry attempting to escape.
1147,1,Negative ID,"doesn't fit color scheme but size seems right, i've never seen one of these before."
1148,1,Negative ID,It has a yellow striped body so we wanted to submit it. It was hoving over the grass in the yard and we smashed it. It did not make a loud buzzing noise. It was about 1 inch long
1149,1,Negative ID,My sister n law for the hornet on the ground while we were getting ice cream at Sun Lakes Resort.
1150,1,Negative ID,Looked about 1.5 to 2 inches long
1151,1,Negative ID,Asian Giant Hornet
1152,1,Negative ID, 
1153,1,Negative ID,Not sure if this is one or not
1154,1,Negative ID,big and fast
1155,1,Negative ID,About 1-1.5” - was flying alone. Could be a wasp but I’ve never seen one this big
1156,1,Negative ID,"Found dead in garden, different from other hornets I've seen in past"
1157,1,Negative ID,I live I. West Seattle adjacent to a green belt.   There were several hovering on and around flowering mint
1158,1,Negative ID,Looks like a bald faced hornet.  Please can you confirm?  It's about an inch long.
1159,1,Negative ID,About an inch long.  Longer if you include the length of stinger.  Almost entirely black with some yellow on legs and antennae.  Still have specimen contained.
1160,1,Negative ID,Was walking up our driveway and noticed a new hive of bald faced hornets
1161,1,Negative ID,"I don't know what it was, but I was pretty frightened."
1162,1,Negative ID,Giant Asian killer wasp
1163,1,Negative ID,Picture was taken at Sumner Rv in Sumner Wa.
1164,1,Negative ID,"It was hovering over some flowers at the Magnolia Viewpoint. It looked very much like the picture, and I distinctly recall the orange and black and size of it. It was probably 1.25”"
1165,1,Negative ID,I found this last night.  I still have it.
1166,1,Negative ID,"On my NW corner of my 1.78 acre property, I saw three distinctly marked Murder Hornets land amidst the cut Douglas fir tree. We are located on the very public Tolt Pipeline trail and there are more than 20 holes in the ground underneath a row of mature c"
1167,1,Negative ID,Found many of these on property.
1168,1,Negative ID,"The insect seemed dormant, but I was hesitant to get too close.  Pictures are included."
1169,1,Negative ID, 
1170,1,Negative ID,We have what seems to be several nest of these in the ground in our garden area. The hornets are huge.
1171,1,Negative ID,"While pressure washing this guy must have been blown out of the low growth in my flower beds/ground cover. It was stunned for long enough that we got some photos, then regained itself and flew off."
1172,1,Negative ID,"digging a hole on the beach at Lake Sammamish State Park,  I took a picture being not sure if it was."
1173,1,Negative ID,Found on a float near our pool
1174,1,Negative ID,It's really big and has been digging holes into the ground
1175,1,Negative ID,"2 large (2”) orange with black rings flying fro area being weededbin neighbors yard. Very aggressive, tried to get a picture but the wee in the dry grass and hard to see in the photo"
1176,1,Negative ID,"The insect was very large--more than an inch in length.  I can't find a similar picture online.   The back end of the insect is half orange and half black, i.e., not striped, with stinger sticking out.  I've seen 2 at a time several times in the past 7 -"
1177,1,Negative ID,"I realize this isn’t an Asian Giant Hornet, but found this thing in the Ridgefield area...would like to know what it is."
1178,1,Negative ID,"Two inch orange hornets are digging holes and mounds in our dry, sunny backyard. There are at least 5-10 holes."
1179,1,Negative ID, 
1180,1,Negative ID,"sited a giant nest high up in a pine tree.  Seeing hornets, pretty big. I can't be sure they are the Asian hornet."
1181,1,Negative ID,"noticed this nest in a tree on our walk. Down a dead end in our neighborhood, not sure what type of nest it is. Just wanted to share in case."
1182,1,Negative ID, 
1183,1,Negative ID,This looks like one but I’m not 100% sure. I was waiting in my car at the Shell gas station in Bellevue and it landed on my car. This is a still from a video I took.
1184,1,Negative ID,"The hornet is at least an inch long and more orange and black in color, with long orange legs that hang down when flying. It was in our oregano bush and would hover as it moves. It ignored me but seemed to know I was there."
