,Label ID,Label,Notes
0,0,Positive ID,"One dead wasp seen in Blaine, and suspect flying nearby"
1,0,Positive ID,Hornet specimen sent to WSU
2,0,Positive ID,"This was the colony that was found and destroyed in Nanaimo, BC Sep 18, 2019. There were ~150 live hornets and ~600 unhatched eggs & larvae"
3,1,Negative ID,"I’m not sure what this is, but it was the biggest looking wasp/hornet I’ve ever seen, at least an inch long. Sorry for the poor quality picture, I went inside to get a glass to catch it and it flew away."
4,1,Negative ID,"slow moving, i have this in the freezer still i think. I saw 3 of them 98588"
5,1,Negative ID,It landed on my window while working. It walked around and then bounced across it as it tried to fly into the glass.
6,1,Negative ID,"Probably not an Asain Hornet but still a pretty mean looking one that I can't I.D. Second sighting that day, both found while cutting down dead Hemlock trees."
7,1,Negative ID,"Was on the garden hose. It stung (maybe just a bite but there was only one puncture hole) the palm of my hand. Approximately 1.5 inches in length, dark dark brown with thin yellow markings."
8,1,Negative ID,"Not sure if this is the target pest, but I figured we would send the picture in for examination. The head came off when we removed the pest from the cowling on an engine."
9,1,Negative ID,not sure if this is one. but in case it is. Saw it at Bayview farm and garden nursery on Whidbey Island
10,1,Negative ID,We live on the coast and are familiar with the bees and wasps in our area. We are outside most of the day until night. We kept remarking about a strange huge bee buzzing around that was orange and we’ve never seen before. I have no picture but will try
11,1,Negative ID,"I live in Newcastle, WA and found a dead one on my front porch. I will leave it there if you want to confirm"
12,1,Negative ID,"Saw this big bee on my back deck, tried to look it up but I couldn't find a match.  Very large and in my entire life I have not seen one like this in Washington state. Thank you."
13,1,Negative ID,"was in my house in Spokane, WA"
14,1,Negative ID,"We weren’t sure what these were, but they are huge and we had never seen anything like them. We saw them in Crescent Bar by the swimming pools."
15,1,Negative ID,"Hello! This 'wasp' type insect bit my husband and I last Sept.  I grew up in the PNW, am a longtime gardener and have never seen anything like this.  I don't know if this is the hornet that you are referring to but it looks very familiar.  It was huge an"
16,1,Negative ID,"This is the cicada killer, either Sphecius grandis or Sphecius convallis."
17,1,Negative ID,I saw this trying to start a nest on the eve of my garage door. I hit it 3 times with a broom until it finally left. I have not seen it since then. It was 1 1/2 to 2 inches in length.
18,1,Negative ID,"I killed this in my back yard a couple years ago. Didn’t think anything of it until I just read your article. Not sure if it’s a Asian giant hornet, but figure I would share."
19,1,Negative ID,It was the only one located and was put into a pickle jar - the hand holding the jar is an adult females hand
20,1,Negative ID,i read the article on them about a week ago and noticed these abnormally big looking bees outside my window and made me curious because they were messing around with the small looking hives i have seen before that are usually around houses. i did not not
21,1,Negative ID,Was dead on the ground..looked like it had Larvae.  Large park across the street
22,1,Negative ID,"My initial thought was, ""this looks like a huge bumblebee. It was sluggish, appx. 1.25"" long, and I moved it from patio to lawn.  I don't believe it's the Asian hornet, but would like to know if you can identify it. Is it dangerous?"
23,1,Negative ID,"Over an inch long. I have single-paned windows and I only noticed my window thumping because I thought it was wind. It was this bug flying into the window repeatedly. I thought the time of day was strange, along with it’s size. It was not not skinny."
24,1,Negative ID,"Very large wasp that landed on my window ledge, see picture.  I did not know at the time to look for an orange face, I don't know what the face color was.  The window ledge is about 3 inches"
25,1,Negative ID,"I am not sure what this is, but I saw this on my living room wall one evening.  I had returned from visiting my daughter in Tx  on Feb 11, 2020,  who had been in Thailand in January."
26,1,Negative ID,"Walking in our field observed these bugs hovering around the ground, & then going into holes.  I’m not sure they’re Asian hornets, because they’re the approximate size of a honey bee."
27,1,Negative ID,"Our AWESOME dog caught and chewed this monster hornet, so it has saliva and mud on the body. My son severed the neck - as it was writhing. I have saved it to submit if someone wants it."
28,1,Negative ID,"Photo taken August of 2013 at Moran State Park. Massive hornet/wasp whose stinger was close to an inch long. In the photo the stinger is kind of hidden behind the wing, but the stinger extends past it a bit."
29,1,Negative ID,This bee is larger as a normal bee
30,1,Negative ID,"Not Asian Giant Hornet but large, different than I have seen in West Seattle and hard to kill, so here it is."
31,1,Negative ID,"This bee was at my hummingbird feeder. I wasn’t able to get a very good photo, so it might be impossible to tell.  The bee looked particularly large and reminded me of one I saw about a month ago but was unable to photograph.  It landed on my kitchen w"
32,1,Negative ID,I was told to send this to you guys even though it was 2 years ago. I've seen about 3 since then around george and quincy area. I had no idea we werent supposed to kill them.
33,1,Negative ID,Trapped this one
34,1,Negative ID, 
35,1,Negative ID,It is very near the house but in the dirt.  It seemed to be looking for something in the dirt.
36,1,Negative ID,"Found this in my horses water tank near  Trinidad, Wa."
37,1,Negative ID,"It is a little over 1 inch, and I doubt that it is an Asian Giant Hornet. However, it doesn't look enough like what I am familiar with."
38,1,Negative ID,"Glengary Rd, Bellingham, WA. There is a big bee nest appeared out of nowhere on top of the mail box."
39,1,Negative ID, 
40,1,Negative ID,Much bigger than a Yellowjacket we s aw at the same time. Around 2 inches long
41,1,Negative ID,All black at least two inches long with visible stinger. Seen twice two years ago in same location. Single hornet chewing on wood fencing 10-14ft from Creek with dense blackberries along most of the Creek.
42,1,Negative ID, 
43,1,Negative ID,Pictures don’t de justice. Face was orange and wasp was size of thumb.
44,1,Negative ID,Found in our tent we set up in our yard. There were two and they caught our eye because they were so large. Unsure if they are so figured I would report just in case.
45,1,Negative ID,"1.5-2 inches long, all black with one small yellow marking on its body. Long wings. Looks like it was trying to eat a spider. Probably not Asian wasp, due to the lack of yellow head but after it was smushed with a shoe, it had a giant opening where it’"
46,1,Negative ID,"Large and wide, yellow head, black body with yellow stripes big black eyes Was sitting on one of our Adirondack chairs, wings were back and it was sitting very still.  Didn’t look like anything I had seen before, I hit it with a fly swatter and it look"
47,1,Negative ID,set trap
48,1,Negative ID,I found this dead outside of my business years ago.
49,1,Negative ID,Was attached to my window at work.
50,1,Negative ID,Black face. We have it captured alive if you want it
51,1,Negative ID,My dog ate one and threw it up in the house
52,1,Negative ID,Found at our front door. Curious what it is.
53,1,Negative ID,I’m not sure if this was a giant Asian hornet but it was GIANT!
54,1,Negative ID,It was in our back yard in Lacey WA
55,1,Negative ID,I think it may be an elm sawfly but I figured I would submit to be sure. I have a few more pictures. It’s body length was greater than an inch. Looks like a hornet to me.
56,1,Negative ID,"I killed it, but I still have it. It is 1 1/2 inches long"
57,1,Negative ID,I saw on the trail/walking path near Lake Chelan River Reach
58,1,Negative ID,Very large hairless legs
59,1,Negative ID,This hornet came flying by us and around us when we were in our back yard swimming pool. I have More pictures and a  video of it as well if needed please send an email or call.
60,1,Negative ID,"(2) discovered on property. 1st one captured, now deceased, in mason jar (still have it). 2nd one spotted today 5/2/2020, killed on sight."
61,1,Negative ID,I understand there may be AGH traps that can be made to catch them--how do you make it?!  Thanks--john
62,1,Negative ID,Never have seen a bee like this and I have lived in Washington my entire life.
63,1,Negative ID,East Bremerton Kitsap county
64,1,Negative ID,it was about two inches long and flew really slow. The neighbor seen one later that year also who lives about a mile and half away. Only one I've ever seen and I took pictures because it was so huge.
65,1,Negative ID,We found this guy eating our rhubarb plant last year. It was the biggest stinging insect I have ever seen. I looked it up and they said it was an Asian Hornet and it was harvesting my rhubarb leaves as nest building material. We took pictures so I could
66,1,Negative ID,"The images I am attaching are from last summer. (Aug 2019) These were ground-burrowing insects. Images are poor (cell phone) quality, taken from a distance of several feet away. Lat/Long is from google maps; it is my parents-in-law's back yard."
67,1,Negative ID,I am a bee keeper and one of my hives was a dead-out this Spring.  It must have died late October or early November.  It was a huge healthy hive with ample honey comb to make it through the winter.  Upon Spring inspection in March the hive died.  There w
68,1,Negative ID,"My picture is not doing justice to the size of the creature we came across. It was over an inch long. It did not appear to be dead, but was also not attempting to fly. It kind of looked like it was stuck in the mud? It is a breezy, cool day."
69,1,Negative ID, 
70,1,Negative ID,"I believe we may have had these in a ground nest by our house last summer. Orange face, large. Unfortunately I did not take phone, but can excavate in nest site."
71,1,Negative ID,This was definitely an Asian hornet.  It was inside our cabin and we trapped it in a glass to get it out - tried our best to get a picture as it was so inordinately huge and scary looking.  We hadn’t realized what it was at the time or we would have do
72,1,Negative ID,Very large hornet on the bike paths at SeaTac park.
73,1,Negative ID,This was killed. Its huge
74,1,Negative ID,I killed this last July and took pictures because I’d never seen anything like it. I have 2 pictures
75,1,Negative ID,We saw this hanging out on our shed.  We think it might be a yellow jacket but it was abnormally large.  Since we're not insect experts we decided to send it in just in case.
76,1,Negative ID,"On Friday, May 1st, a sighting was made of a bee that was abnormally large in size. When it was discovered, it had an exceptionally long black stinger, ranging from half an inch to one inch. It was first believed to be a really large bumble bee, until ar"
77,1,Negative ID,On my grandson’s flip flop.  About 2” long.
78,1,Negative ID,"Found on our deck.  It was striking because it was so large.  Also the wings seemed unusual, sticking more out from the body instead of following the contour of the body.  It was alive, but struggling.  The head was also more orange than the typical yell"
79,1,Negative ID,Damn near 2in long and thick
80,1,Negative ID,There was 1 maybe 2 large bees (?) in among numerous other normal size bees  at a boat ramp in central ferry.  I don’t think it’s what you’re looking for but here is a pic
81,1,Negative ID, 
82,1,Negative ID,"1.5-in yellow/black giant striped bug seen in my yard in Mountlake Terrace, WA. I hadn't heard of the Asian giant hornets when I saw this but took a picture because it was such a surreal-looking bug. I have also reported this through the WISC app. The ph"
83,1,Negative ID,I saved my photo in my phone and tried looking it up to see what kind of bee it was but didn’t find any information on it. Can you let me know if it’s the Asian bee?I also have more pictures showing it’s size. I have one next to a quarter so you ca
84,1,Negative ID,I believe I have the hernet's nest.  I saw them flying around my yard last summer.  What should I do?
85,1,Negative ID,I have had four of these I think. They are large with an orange head and dig holes in the dirt and make a burrow. I have killed as many as ten last summer.
86,1,Negative ID,"Found this bee in the living room, hovering and banging into the living room light. It was killed by blead water spray."
87,1,Negative ID,"We are unsure this was an Asian Hornet, but it was certainly unlike anything we had seen before...or since. Here is a link to the original Facebook post. ( "
88,1,Negative ID,Found it dead in pool filter
89,1,Negative ID,We have them in the back yard
90,1,Negative ID,It was in my raised garden bed and seemed slow moving until I killed it.  It was huge and angry.  Not sure why it was in my raised garden bed weeds.
91,1,Negative ID,"This was found dead outside of our garage on the evening of June 4, 2018. Took pictures because it looked unlike anything we had seen before, but after a few months we threw it away."
92,1,Negative ID,"I believe I have an underground nest of these hornets in my back yard.  I noticed after disturbing it while mowing.  I do not intend to get close enough to get a photos, but there is a distinct orange coloring to these bees."
93,1,Negative ID,I have 3  active mason bee homes on my property. This gigantic hornet that seemed too big for the time of year was interested in the mason bee house before flying away. It was a very large  looking yellow jacket but could not confirm coloring with pictur
94,1,Negative ID,My neighbor captured a hornet in a plastic container and brought to me to discuss. I’ve attached picture. Neighbor still has the hornet if you want to collect and confirm identification.
95,1,Negative ID,We have captured a very large hornet that was in our house it is still alive under glass
96,1,Negative ID,"Found this hornet, dead, in our animals water dish. We are located in Chewelah, Washington in the northeast part of the state."
97,1,Negative ID, 
98,1,Negative ID,They were not shy
99,1,Negative ID,"I know this was before the official siting, but I came across this picture from lat June in Lake Chelan.  It was really large which is what caught my attention.  Not sure if it is one, but thought I would let you be the judge."
100,1,Negative ID,Found dead on a steel truck.
101,1,Negative ID,It was eating the wooden sign.
102,1,Negative ID,Dead on our window sill
103,1,Negative ID,Large hornet similar in shape and color to Asian hornet cane through my sun roof and landed on my lap.
104,1,Negative ID,This giant bee was dead on the side of the road in our neighborhood. It is quite large but can’t tell exact coloring.
105,1,Negative ID,Never seen in 46 years of gardening in this property
106,1,Negative ID, 
107,1,Negative ID,Found it dead in the driveway today. It is hollowed out and may have been bleached by the sun.  Never saw anything like it b4.
108,1,Negative ID,Captured a large wasp or hornet (in my freezer) and concerned that it could be an Asian Hornet.
109,1,Negative ID,Found dead on my deck - see photos:  
110,1,Negative ID,It was 1-2” in size.
111,1,Negative ID,I was on a walk in puyallup and found this large dead bee.
112,1,Negative ID,We killed it
113,1,Negative ID,I noticed an insect in a puddle on my back patio and then discovered this hornet/ wasp
114,1,Negative ID,"We have a camera on our porch, and this ""hornet"" appeared in our security video this evening. We have never seen anything like this before. The video is poor, and there is probably some other explanation, but we wanted to make you are aware of the possib"
115,1,Negative ID,"There are three nests that are unusual. I have studied bees in environmental science and the location is between forested land and wetlands. One is on the house and the other two on the two horse stalls. We commonly see other nests, but these are very di"
116,1,Negative ID,"Saw this large hornets with bright orange color on it flying around backyard outside light at night. It also flew around, hovered around patio door. It appeared to be attracted to the light. We have a wooded area behind our house. Was only able to take a"
117,1,Negative ID,It's about 1.5 inches long. It made a very loud buzzing sound. We captured it alive.
118,1,Negative ID,Has a yellow head but orange body
119,1,Negative ID, 
120,1,Negative ID,This is the second insect that my mom has killed in her yard. It is orange
121,1,Negative ID,Not the Asian hornet but I can’t figure out what it is and we haven’t seen it before
122,1,Negative ID, 
123,1,Negative ID,"2 inch wasp/hornet. Orange abdomen. Not sure about the head, we were too scared. First time I saw something that big."
124,1,Negative ID,"This insect was on my deck, it was pretty slow, looked on its last legs. Please follow up with ID. It looked slightly less orange like yellow than murder hornet pics"
125,1,Negative ID,Have kept in plastic bag
126,1,Negative ID,I found this dead in my driveway and it color and size fought my eye.
127,1,Negative ID,"My mom killed one of these yesterday, today she trapped a live one. They are about an inch long. Here is the video"
128,1,Negative ID,Large hornet (about 1.5 inches) landed on dining room window.  Got several pictures.
129,1,Negative ID,"On May 15, we found two dead honey bees on the front porch.  Their heads had been removed and were lying nearby.  Attached is a picture of one of the bees.  While we haven't seen any giant hornets, we found the dead bees odd and concerning.  We are prepa"
130,1,Negative ID,"Flew into my car, still in car, insure weather to keep it in there"
131,1,Negative ID,"The insect flew around the lit balcony, repeatedly running into and landing on the glass windows over the course of 10 minutes as of the time of the report."
132,1,Negative ID,Found this in my garage this evening. It is at least 1.5 inches long. Not sure if it is a Murder Hornet. It looks like it is in the early stages of growing hence the translucent body. I covered it with a glass and took these pictures.
133,1,Negative ID,Pretty sure yellow jacket but better safe than sorry - have it trapped in some Tupperware.
134,1,Negative ID,Saw this thing when I entered my car headed to wall and Francis to pick up my son from school
135,1,Negative ID,It’s super long and has 6 legs
136,1,Negative ID, 
137,1,Negative ID,Was sitting on the ground.
138,1,Negative ID,It was in our house 2xs
139,1,Negative ID,A friend spotted this a little over a week ago
140,1,Negative ID,"Dont know if its the killer bee or not, it was about 1 in long"
141,1,Negative ID,You can call me on my cell 206-255-7713 if you can't access this video.
142,1,Negative ID, 
143,1,Negative ID,I found this group of bees at the park. They were all together at random distances from each other. They were not there yesterday afternoon. So maybe this happen overnight. They are dehydrated and some of them looked as if they were attacked by another i
144,1,Negative ID,Found it in the flower bed among other bees. Could be a sawfly.
145,1,Negative ID,I reported this earlier and did not think that had a picture .attached is a poto that I took of it
146,1,Negative ID,This is the second time I’ve seen this in my backyard chewing on my fence.
147,1,Negative ID,"My friend took this picture today in Ferndale, WA"
148,1,Negative ID,At least 2 inches long
149,1,Negative ID,"About 1.5"" long possible murder hornet. Not sure. Or large queen hornet of some sort. Have it still in a jar."
150,1,Negative ID,Think it’s just a fuzzy bee but husband was wondering if baby murder hornet?
151,1,Negative ID,We drove to Bellevue on 5/5/20 and returned to Spokane on 5/6/20 by way of I-90. Our truck has been garaged since then. When moving it tonight we noticed the attached hornet in the grill. It's head appeared to be yellow but not much was left after the im
152,1,Negative ID,Found on Target Lynnwood parking lot
153,1,Negative ID,"I found this post on the local facebook page for Chinook, WA. I don't know if it was reported to you or how legitimate it is but I thought I should pass along the info.  "
154,1,Negative ID,We saw this on our way down from a hike in the Chuckanuts. It was the largest hornet I've seen and the head was crushed so it was hard to see whether it had a yellow head. I'm thinking it might be an elm sawfly but I thought we would report it anyway.
155,1,Negative ID,Found in brother in laws truck while camping
156,1,Negative ID, 
157,1,Negative ID,We found this giant wasp-like creature when packing up our truck yesterday after camping at our property in Lebam Washington. I live in Kent WA but was at the property all weekend.  My brother still has the bug in a ziploc bag down in Lebam.  My phone is
158,1,Negative ID, 
159,1,Negative ID,Insect was obverved on 5/23 and 5/26 on one of our security cameras.  Image quality is poor.  .mp4 files are available for your review
160,1,Negative ID,We’re on mercer Island and wanted to report
161,1,Negative ID,I live close (N 48.660139 W -123.396815) and parallel to San Juan Island.  I was able to capture this clip (attached) from my security camera. This is the second time I've seen one of these.  It is easier to see details if you view screen-by-screen.  I h
162,0,Positive ID, 
163,1,Negative ID, 
164,1,Negative ID, 
165,1,Negative ID,Community member wanted to know if it was dangerous or non-native.
166,1,Negative ID,Larger than other kinds here. Haven't seen this kind here before.
167,1,Negative ID, 
168,1,Negative ID,It was the largest wasp/hornet I've ever seen.  I saved the body in case it is indeed a murder hornet.  Thank you.
169,1,Negative ID,Driving north I-5 hit windshield
170,1,Negative ID,It was as large as my thumb knuckle to nail. About an inch. Sluggishly walking across my deck alone.
171,1,Negative ID,Eating out of our hummingbird feeder
172,1,Negative ID, 
173,1,Negative ID,A few days later my husband trapped it in this sandwich bag. It has been in the sandwich bag for over a week and is still alive.
174,1,Negative ID,I caught it in my room. It came in when i opened my window
175,1,Negative ID,"Found this specimen at Twin Falls Hydro on the south fork of the Snoqualmie river at I-90 exit 38.  My son works there.  It bug was next to the dumpster and was not able to fly.  We killed it with a 2x4, so it looks a little squished in the abdomen and i"
176,1,Negative ID,I had a piece of insulation fall out of my roof and it was filled with bees. They were in a bad spot to wait to get a beekeeper so I sprayed them. After they were dead I moved the insulation and several bees fell out including one that is significantly l
177,1,Negative ID, 
178,1,Negative ID,This was on our sticky bee trap thing we putchased.....its eyes and overall look just looked different then what I am used to seeing and the orange yellow color.......what stuck out the most was the eyes and the stinger
179,1,Negative ID,"Just submitted a form but forgot to add my contact info............i saw this on my bee sticky trap thing we purchased and it looked different then what I am used to seeing........what stuck out the most was the eyes, the orange yellow coloration and the"
180,1,Negative ID,I took this picture on our front sidewalk May 11. I saw the news today and it looks like it may be worth submitting.
181,1,Negative ID,I have a security camera on the back deck of my home. T picked up this video that looks very much like the the Asian Hornet but I could be wrong so I am attaching the video from my canera
182,1,Negative ID, 
183,1,Negative ID,Unusually large-but not a bumble bee; about 2”; loud buzzing
184,1,Negative ID,We found this dead bee on our patio this morning in Freeland on Whidbey Island. We are wondering if it’s one of the Asian Hornets.
185,1,Negative ID,"Looks like an enormous bee, but had an orange and some green under belly.  Doesn't look like any of the pictures above."
186,1,Negative ID,"Out for a hike in North Spokane. This honestly was a much larger hornet than a regular hornet seen. I delayed reporting because at the time no one had seen a Giant Hornet on the East side of the state. I know the head doesn’t match the description, but"
187,1,Negative ID, 
188,1,Negative ID,Discovered dead in the garden boxes. Ants appeared to have been eating it. Much larger to me than insects I’ve seen. Face strikes me as unique to this particular hornet. Abdomen also makes me believe it is a non-native hornet. No wings were found. The
189,1,Negative ID,Found on side of my house. Easily over an inch long. Scary bastard.
190,1,Negative ID,Hornet was trapped under oudoor skylight. A sprayed it and it imediately flew away.
191,1,Negative ID,"Liberty Lake, WA"
192,1,Negative ID,"Saw dead/squished bug on sidewalk outside Nordic Heritage museum,  Ballard."
193,1,Negative ID,Found dead in front porch
194,1,Negative ID,"just found this in our flower bed, huge and lethargic"
195,1,Negative ID,Found floating in my kids water table. Unsure of species.
196,1,Negative ID,"Looks like a big yellowjacket, but yikes!"
197,1,Negative ID,Chambers Bay Golf Course
