,Label ID,Label,Notes
1437,1,Negative ID,"I’m thinking that it’s not the Murder Hornet, but wanted to send you this anyway."
1438,1,Negative ID,Campers sighted and killed what appeared to resemble two ‘murder hornets’ in their campsite at 12:15pm. They did not preserve the insects but provided photos for reference.
1439,1,Negative ID,Was found laying on a leaf on the ground in the shade in our backyard.
1440,1,Negative ID, 
1441,1,Negative ID,There were two together.
1442,1,Negative ID,Not sure but Im thinking not.
1443,1,Negative ID,Coloring on the face doesn’t look right but I hadn’t seen anything like it around here. Please let us know.
1444,1,Negative ID,Large hornet. Orange and black at the end but not striped. Big dark eyes.
1445,1,Negative ID, 
1446,1,Negative ID, 
1447,1,Negative ID,"5pm in my flower bed, I think a second one flew in as well, but smaller. We did not get a photo"
1448,1,Negative ID,Found hornet on the interior side of kitchen window screen
1449,1,Negative ID,"Not sure if this is one, but reporting just in case. Coming in and backing out of in ground hole"
1450,1,Negative ID,I have caught what may be an Asian Giant Hornet. I have sighted this bug 4 times on our property in Freeland Wa. The insect is 1.75 inches from nose to end of stinger. The face has a small amount of orange above both eyes. The legs are black and yellow.
1451,1,Negative ID,Flying low around back yard. Killed in dirt. Face is yellow.
1452,1,Negative ID,giant basketball sized paper nest
1453,1,Negative ID,This thing was HUGE!
1454,1,Negative ID,"Saw this nest on the way down the Goose Rock summit trail at Deception Pass. I did not see any hornets or bees close-by. The nest was closer to the summit, prior to the signs indicating the intersecting trails - it was behind a tree just off the path. Pr"
1455,1,Negative ID,Large hornet chasing another bee on laurel bush.  Photo is blurry. Largest hornet I have ever seen.
1456,1,Negative ID,Was a single bee around our bee trap
1457,1,Negative ID,I was picking my green beans from the garden a saw the bee alive on the leaf.
1458,1,Negative ID,"She flew into the vehicle on my wife’s side, my wife thought she was gone. We found her on the floorboard “standing”, no one was hurt and I killed her."
1459,0,Positive ID,"Spotted at outdoor dining in Birch Bay, posted to WSDA Facebook site"
1460,1,Negative ID,About 1” in length. After reviewing pictures lack orange color on face
1461,1,Negative ID,My Mom found this bee in our yard today. She said it was already dead when she found it.
1462,1,Negative ID, 
1463,1,Negative ID,It was 2-3 times as big as hornets around it
1464,1,Negative ID, 
1465,1,Negative ID,large wasp has been frequenting our garden. loves the onion plant flowers
1466,1,Negative ID,Was flying around basil and lavender. Looked way larger than bumble bees flying next to it.
1467,1,Negative ID,never seen this type of big hornet or whatever I just caught. Bright yellow head big body..trapped it in a pool net still alive and trying to get a picture but it called a bigger buddy in for help so now im inside.
1468,1,Negative ID,The bee was about 1.5 inches long with pretty big wingspan. Was orangish yellow in color but did have a solid black rear. Was not able to get close enough to see if it had a stinger or get a better picture of it’s head.
1469,1,Negative ID, 
1470,1,Negative ID,I thought this wasp was a cricket at first. I have a 5second video that might be clearer if unable to identify.
1471,1,Negative ID,he made the regular bees look like little flies. Was checking out all my dead rose buds
1472,1,Negative ID,"Its mostly black, with yellow stripes on legs and yellow striped head. The second picture is for idea of how big. Man holding it is the one who found it."
1473,1,Negative ID,I was getting food I had gone camping with when this big bug came flying out of the space like nobodys business. I am on camano Island and i couldnt trap it so i cut it in half. Here is a picture of it with a quarter for size reference and thentwo halfs
1474,1,Negative ID,"Is this an Asian giant hornet? If not, what is it?"
1475,1,Negative ID,Seen going into a hole in the ground.
1476,1,Negative ID,Looks to have the orange on its face. Body is about 2 inches long. The body is dirty in the photo because I swatted it when it approached.
1477,1,Negative ID,I recently submitted this form but the pictures weren't uploading. Please see submission prior to this for additional info.
1478,1,Negative ID,Not sure what this is but thought I would check
1479,1,Negative ID, 
1480,1,Negative ID,"Never before seen on our property in Enumclaw, WA.  Apologies I could not get closer, but it is on the right edge of the teacup saucer, near a decorative button.  About 1.5"" long, mostly black body with distinctive black and yellow striped legs."
1481,1,Negative ID, 
1482,1,Negative ID,"Hello!  We were in our backyard (in Lynnwood) and came across this bug! It is yellow and black, and over 2” long (for reference that bolt head it is sitting next to is 19mm), with a huge stinger......with all the buzz about “murder hornets” I can"
1483,1,Negative ID,Found while trimming trees
1484,1,Negative ID,"Found this crawling in the grass.  Yellow head, black eyes, black thorax, black abdomen with only one yellow strip near the end tip.  It is about one inch to one and a quarter in length"
1485,1,Negative ID,We just got a few trees taken down and we found this guy in some of the brush/branches on the ground.
1486,1,Negative ID,I’m not sure what type of hornet this is- but it was about 1.5” long. Orange and black.
1487,1,Negative ID,Appeared to be seeking pollen/nectar from succulent blossoms.
1488,1,Negative ID,They are very large & very dizzy.  They look like large bumblebees as they are pretty fat
1489,1,Negative ID,"Noticed two of these guys flying around, trying to feed off blooms in laurel bushes.  They were very aggressive toward each other and would take off quickly as soon as I approached, hence the poor quality pictures."
1490,1,Negative ID,Observed insect and backyard on bark of a tree
1491,1,Negative ID,Not sure if this is one or not...
1492,1,Negative ID, 
1493,1,Negative ID,"I don't observe any yellow stripes except for some markings around the face and legs.  It measures about 1-1/2"" and its stinger is enormous.  It is currently alive and angry."
1494,1,Negative ID,I watched the insect digging a hole in the ground like digging out a ground nest. I also saw one pull out a carcass or cocoon type thing about the size of the insect itself. They looked between 1-1.5 inches.
1495,1,Negative ID,Found it Dead in Everett Wa
1496,1,Negative ID,"Extremely large hornet flew into a small ground hole in a mulched area near my office building. We saw a grasshopper near the hole then the hornet came back up, grabbed the grasshopper and dragged it back into the hole"
1497,1,Negative ID,"I felt something hit my left arm, I swatted blindly with right hand, I hit it, it was hovering out in front of me and I hit it to the ground with my hand and then hit in the head with a small tool!"
1498,1,Negative ID,We caught it alive
1499,1,Negative ID,Melody and Lova
1500,1,Negative ID,Have seen multiple hornets in our back yard and nearby - the picture provided is from a zoomed in video which we can send if necessary
1501,1,Negative ID, 
1502,1,Negative ID,Husband went into the yard - stepped on it - could feel it fluttering its wings and clearly it was larger than a typical bee. It is injured and we do have it contained for the time being.
1503,1,Negative ID,"The bee was on our car in Maple Leaf, Seattle. It was approximately 1.5 inches long (perhaps a touch longer), and very thick. It does not appear to match any bees we can find online, but most similarly looked like the giant Asian hornet without the back"
1504,1,Negative ID,Photos don’t do justice on the size
1505,1,Negative ID, 
1506,1,Negative ID,Lynwood Transit Center parking lot. Bee was an inch and a half. Squished it because it was by my kids.
1507,1,Negative ID,Found and killed on a fence post in our backyard by the contractor replacing our fence. I may have seen one last week in our backyard by our pond. I found a picture of the bug I spotted and it looked like a giant Asian hornet.
1508,1,Negative ID, 
1509,1,Negative ID,I think I saw one in my back yard.  I
1510,1,Negative ID,Not sure what this is but didn't want to take any chances!
1511,1,Negative ID,Found on driveway of my home at 3209 gay rd e tacoma
1512,1,Negative ID,Found dead floating in horse water containers
1513,1,Negative ID,Bigest yasp I've ever seen here.
1514,1,Negative ID,Giant Asian Hornet found in grill of car after lifting hood. The hornet is dead but stuck in grill of truck.
1515,1,Negative ID,Large hornet landed on hummingbird feeder
1516,1,Negative ID,Found on inside wall of a greenhouse
1517,1,Negative ID,This stayed on my sons leg and would not get off. Luckily it did not sting him.
1518,1,Negative ID,Observed a Hornet flying around flower.  Tried to take a picture several times but was only able to obtain a fuzzy picture.
1519,1,Negative ID,Way too big to be anything else
1520,1,Negative ID, 
1521,1,Negative ID, 
1522,1,Negative ID,Trapped it on our homemade plastic jar trap
1523,1,Negative ID,"They were with a lot of pollinator bees, they seemed to be feeding off the pollin as well, or flying from flower to flower."
1524,1,Negative ID,"About 2inch long and still alive, call me"
1525,1,Negative ID,Found this under the mat in truck not sure if it’s one of the bees or not. No head this is all that was there.
1526,1,Negative ID,Many other bee types among these distinctly large and orange bees. Only saw about 4 in neighborhood bush near community garden where I spotted others earlier in the month. There have also been fully black ones the same size that look like giant flying an
1527,1,Negative ID,I have no idea what this is but we found it on our walk this morning. I think it may have been run over and I don’t necessarily think it’s a murder hornet however it is unusual so I thought I would send it.
1528,1,Negative ID, 
1529,1,Negative ID,Larger than normal hornet not sure of species see photo. I have short videos of each pic.  Tried to catch but flew of when i returned with jar.
1530,1,Negative ID, 
1531,1,Negative ID,My son said he got bit and they’re trying to next in some freshly cut weeds
1532,1,Negative ID,It’s stinger got stuck on the window screen but it was able to get free before I could capture it.  It was approx 1.5-2”.
1533,1,Negative ID,Seen feeding on flowers from mint plants
1534,1,Negative ID,Large wasp or hornet near mint in our garden. Will attempt to trap it. Difficult to identify since it is not trapped.
1535,1,Negative ID,This is the second wasp we ve observed in our yard this summer
1536,1,Negative ID,"We live in Vancouver Wa, The wasp was in our  driveway, this date around 2:00PM...80 plus degrees. He appeared to have fallen from my basketball hoop, and we slowly flying in a circle, I swatted and knocked him down due to our grandkids near by, I took a"
1537,1,Negative ID,"It was crawling across the parking lot at my apartments, another resident came along, I told him not to squish it, but he did, I got pictures of the corpse from different angles"
1538,1,Negative ID,Is this a young version of the Asian Hornet. The board it is on is a 2 x 6 for size reference. This bee was at least 1.5 inches long.
1539,1,Negative ID,Not sure what it is but it was an inch and a half.
1540,1,Negative ID,"The insect’s wings may not have been working. It was crawling toward a lavender bush. The legs seem to be much bigger than images of other murder hornets, but it’s markings are hornet like. It was easily over an inch long."
1541,1,Negative ID,My husband shot it with a BB gun here’s half of it
1542,1,Negative ID,I have it in a jar
1543,1,Negative ID,"I’m not sure if this is an Asian giant hornet, but it doesn’t look like the other hornet/wasp types on your page. Photos were taken in my backyard in Olympia."
1544,1,Negative ID, 
1545,1,Negative ID,This was caught in a web on my patio.  Was already dead.
1546,1,Negative ID,This was flying around my neighbors house it had a loud buzzing sound when it was flying. I don't know for sure if this is one of those Giant Asian Hornets.
1547,1,Negative ID, 
1548,1,Negative ID,"This insect was spotted and killed (stepped on) by my coworker's son while fishing off the Toutle River, in Castle Rock, Washington.  I think it could be a Saw Elm Fly, but the head color matches Asian Giant Hornet color.  We are unsure and would like cl"
1549,1,Negative ID,Not sure if this is actually an Asian hornet?? Found dead this morning and ants have eaten most of its body.
1550,1,Negative ID,Apologies in advance if I’m wasting your time. I’ve never observed a wasp nest before in all my hikes. I wouldn’t have bothered until I saw a Asian giant hornet trap at the top of the hike. I’ve read that they build their nest mostly underground.
1551,1,Negative ID,"Very big with odd high pitched ""buzz'"
1552,1,Negative ID,contractor working at my house reported sighting and provided picture - we aren't sure if it is a murder hornet but wanted to report it just in case
1553,1,Negative ID, 
1554,1,Negative ID, 
1555,1,Negative ID, 
1556,1,Negative ID,These hornets are building a nest in the ground in my back yard. Please advise.
1557,1,Negative ID,"Underwood, Wa drinking out of the waterfall at our house"
1558,1,Negative ID,I saw at least 4 different hornets and trapped two.
1559,1,Negative ID,"saw it in my backyard, flying around my blooming oregano plants."
1560,1,Negative ID, 
1561,1,Negative ID,Captured outside home in Kent WA 98031
1562,1,Negative ID,Multiple
1563,1,Negative ID,They are all Over the front yard in the ground.  Can’t find a picture to identify so thought I would just send this in.
1564,1,Negative ID,Larger than paper wasp or yellow jacket
1565,1,Negative ID,A very large hornet!
1566,1,Negative ID,I still have it in a jar if needed.
1567,1,Negative ID,In a flowering herb along with lots of bees. Measures approximately an inch and a half.
1568,1,Negative ID,"Not sure what this is, but its huge. Trapped in a jar. Caught in my backyard in Renton Washington"
1569,1,Negative ID, 
1570,1,Negative ID,Its in a glass jar now and still alive
1571,1,Negative ID,Really loud as he flew
1572,1,Negative ID,Hopefully you’re able to see the video I’ve included. I saw this possible Asian hornet killing another type of bee and pick it up and fly off with it. It was quite a bit bigger than the other insect and it’s wings had a slightly golden shine to the
1573,1,Negative ID,In Pasco - very large- looked like could be one- dead
1574,1,Negative ID,Ground nest
1575,1,Negative ID,There were 3 in the same area
1576,1,Negative ID,"It had an orangey yellow head, Striped/mottled yellow orange abdomen, was about 2 inches in length, thick through the whole length, there were two, they were burrowing into the sand. Did NOT look like a sand wasp. I couldn’t get close enough to get a p"
1577,1,Negative ID,Please let me know what this is. Thank you
1578,1,Negative ID,Was eating a spider on our deck. I have more photos if needed.
1579,1,Negative ID,Found in a fly trap
1580,1,Negative ID, 
1581,1,Negative ID,"Sited at my home in Burbank, Wa"
1582,1,Negative ID,Found in wooded area near our house
1583,1,Negative ID, 
1584,1,Negative ID,Traveled from Roslyn to Seattle on 8/28
1585,1,Negative ID,Photo shows the wasp (I think) on a plum passion hydrangea flower
1586,1,Negative ID,Found in our backyard in Seabeck. Approximate 2” long
1587,1,Negative ID,Observed trapped by spider web
1588,1,Negative ID,Don’t think this is an Asian hornet as it has all black body and head with yellow eyes(?). Was flying at my wife while we were doing yard work. I swatted it first with a gloved hand and hit it with a shovel 4 or 5 times on bark. Thought it was dead and
1589,1,Negative ID,"It was in our house, crawling on my  husband's arm. He hit it off and then stomped on it."
1590,1,Negative ID,North Bend
1591,1,Negative ID, 
1592,1,Negative ID,"I think it is a Bald-faced hornet. Lethargic, on inside window sill. Diff. photo angle"
1593,1,Negative ID,Pic is hard to see but saw this last weekend also.  Found on tree limb we had cut down. My husband killed it accidentally. Not sure what it is but thought I'd ask.
1594,1,Negative ID, 
1595,1,Negative ID,Please advise if this is a wood wasp- not the Giant Asian hornet. Loc 8176 NE Loughrey Ave Indianola WA 98342
1596,1,Negative ID,Captured burrowing in dirt under plant.
1597,1,Negative ID, 
1598,1,Negative ID,Observed while watering flowers frequented by honey bees - killed it (hence it is a little mangled)
1599,1,Negative ID,"Caught one yesterday around 3 pm and saw another around 5 but couldn’t catch that one in time. Located in Everett, WA"
1600,1,Negative ID,Northbound I-5 by the custer rest area hit my windshield the head stayed attached to my wiper the body flew off
1601,1,Negative ID, 
1602,1,Negative ID,It’s huge! But unclear if murder hornet. Never seen one this size. I have it.
1603,1,Negative ID,I was doing some tree branch trimming in my little forest and spotted this big thing
1604,1,Negative ID, 
1605,1,Negative ID,Unsure
1606,1,Negative ID,flying around a wood pile
1607,1,Negative ID, 
1608,1,Negative ID,"We were not able to keep this alive but I am pretty sure it""s a baskin bee. If the picture isnt good I can send it via cellphone easier."
1609,1,Negative ID,Only saw one.
1610,1,Negative ID,"I saw an enormous hornet flying, and when it landed on a nearby rock, I went to see what it looked like. It was carrying another bee/wasp/hornet and eating it."
1611,1,Negative ID,Was flying in my yard when I was cleaning and I slapped it and pinched the back so it wouldn’t fly
1612,1,Negative ID,Found dead in dogs water bucket.
1613,1,Negative ID,On Spirea plant (scale)
1614,1,Negative ID,"Lake Stevens, WA"
1615,1,Negative ID,Hard to get a good picture because it was trapped in the vehicles wiper blade mount. The vehicle was parked in the 750 block of Aloha st in the city of Seattle.
1616,1,Negative ID,"I sent a message several days ago that I saw what I think was a murder hornet in my yard. Today, I found one dead on my driveway. I have attached a photo."
1617,1,Negative ID,Loud as hell when flying
1618,1,Negative ID,"Seen flying near the ground in our front yard, eating a small cricket. Was flying in and out of a hole in the ground. Husband killed it with WD-40. Have the specimen in a jar."
1619,1,Negative ID,Pic
1620,1,Negative ID,The largest flying bee/hornet I’ve ever seen!
1621,1,Negative ID,"Painter knocked one down, alive, and we caught it in a jar"
1622,1,Negative ID,It had no wings though. Probably 1-1.5”
1623,1,Negative ID,I found in backyard. It was in a spider web. It is about 2 inches with a long stinger.
1624,1,Negative ID,Notice honey bees attacking 2 on summer sweet bush (clathrate alnifolia)
1625,1,Negative ID,"Sorry, just reported & now I think it's a digger hornet"
1626,1,Negative ID,In dogs water bowl.
1627,1,Negative ID,Didn’t get a picture...it was on my bike when I stopped.  About the size of my finger from knuckle to nail - a little less than two inches - eating a cricket.  I tried to swat it dead but it flew away.  I took a pic of the big it was eating.
1628,1,Negative ID,I captured this bee on my driveway parking strip this morning around 7am and have it in a glass jar
1629,1,Negative ID,Also hornets came to my backyard two nights in a row. There are many bee hives in next door property under ground.
1630,1,Negative ID,"In my garden on the flowers of garlic chives, 2 large, 1 small"
1631,1,Negative ID,"About 2"" big.  Might be a Horn tail Wasp"
1632,1,Negative ID,Sighted on a light post in the cascade park neighborhood of Vancouver.
1633,1,Negative ID,"I've never seen this type of wasp or hornet. It's quite large compared to yellow jackets.  There are several on a mint plant. It dosent look like the giant Hornets, but is large, as I said before. No stripes, as you can see by photo. Sorry the pics aren'"
1634,1,Negative ID,"Saw in my yard while watering, appears to be1.5 inches long."
1635,1,Negative ID,found in the grass near a plant with lots of bumblebees. Dogs where trying to eat it. It looked hurt.
1636,1,Negative ID,I have it trapped.  Pretty large and would die when I hit it with my flip flop.
1637,1,Negative ID,"Found this on our deck, thought it looked like the workers we saw on TV last week. We put a jar over it."
1638,1,Negative ID, 
1639,1,Negative ID,Found dead near wild bee hive
1640,1,Negative ID,"It's caught in a spider web but is 2 inches long, has a stinger, and looks exactly like the photos of the Asian ""murder hornet"""
1641,1,Negative ID,We were told to report this as people thought it was an asain hornet
1642,1,Negative ID,"Did not see the bees up close. Noticed they are fairly large, majority of the body is black but had some yellow it it. I have two of these nests in my neighborhood where I live in."
1643,1,Negative ID, 
1644,1,Negative ID,I haven't seen a bug like this before - its wings were long and golden.  It sort of looked like a cross between a wasp and a cricket and I didn't think we had cicada killers here.
1645,1,Negative ID,"I saw 2 about 100 yards from eachother. They were about the size of my entire finger. One landed on the fence and it had a big stinger that it looked like it was cleaning or something. I took some pictures, but it was really bright and they aren't very g"
1646,1,Negative ID,In the middle of a sidewalk slab on an arterial road
1647,1,Negative ID,I’m from here and have been a gardener all my life this is not anything I’ve ever seen here before.  I actually sighted it a month ago three days in a row in my garden but could not get close enough to have a good enough picture.  This video shows a
1648,1,Negative ID,Huge hornet with a long stinger
1649,1,Negative ID, 
1650,1,Negative ID,Was flying in our kitchen
1651,1,Negative ID,Not sure if this is one
1652,1,Negative ID, 
1653,1,Negative ID,This bee flew out of blackberry bushes and it was so large!
1654,1,Negative ID, 
1655,1,Negative ID,Found dead on the garage floor.  No others in sight.
1656,1,Negative ID,"Well from these descriptions here, we think it is not the Asian hornet, but most likely a Bald-faced hornet. What ever it is it is really big and he was inside my house in my kitchen window. We trapped him in a 6"" tall clear plastic ziploc plasitc measur"
1657,1,Negative ID,I found a few giant bees on my backyard we caught one and thought it was the only one but today I saw that there are more and they seem to have a nest underground (they keep going under the sand ) I took Picts and video on the photo seems little but it
1658,1,Negative ID,We caught one and have it bagged if you want it ?
1659,1,Negative ID,"I seen 2 bees on August 30, I killed 1. I seen and killed 3 today 8/2 I added a picture which is no the best. I use too have all sorts of bee, honeybees, bumblebees, ect. but they have all disappeared"
1660,1,Negative ID,"Seen in garden on oregano, 1.5-2” long"
1661,1,Negative ID,Found a dead one
1662,1,Negative ID,In my garden
1663,1,Negative ID,It was very large and I saw it emit some sort of spores or pheromone of some kind
1664,1,Negative ID,Found on log. Doesn’t look healthy. Didn’t try to fly away.
1665,1,Negative ID,Flew in patio door at nursing facility
1666,1,Negative ID,Very large hornet appeared to be digging in the dirt by my shed
1667,1,Negative ID,Was waiting for a bus (stop # 973) in Mukilteo when I felt something around the front of my shirt collar. When landed on the ground I stepped on it. It was about an inch long and because he was so orange I’m curious what he might be as I’ve never see
1668,1,Negative ID,Bee found in horse barn trapped in spider web
1669,1,Negative ID, 
1670,1,Negative ID, 
1671,1,Negative ID,Found in swimming pool
1672,1,Negative ID, 
1673,1,Negative ID,"Size and overall configuration match known parameters; however, coloration does not fully match given description."
1674,1,Negative ID, 
1675,1,Negative ID,"This was taken from my ring camera, looks to be trapped in a spider web this is in Ocean Shores"
1676,1,Negative ID,"In my back yard. Large and orange, that’s all I could tell. Tried to keep distance, but wanted to get close enough to take a good photo. Much larger than surrounding bees"
1677,1,Negative ID,I believe this is a bald face hornet. Can you confirm
1678,1,Negative ID,"This is the third report I have made. My son, daughter-in-law, and I all saw the same type of hornet I sent photos of before. I am including photos of the dead one found in the driveway several days ago, and the one my son saw today."
1679,1,Negative ID,huge. It was at least 1.5 long. I got a direct shot of bee spray on it to try and ID but it flew off. This thing was huge and scared the crap out of me.
1680,1,Negative ID,"Found on our porch. It’s falling apart and looks very emaciated. Can’t see in the photo, but it has a stinger. It also has an antenna that has fallen off."
1681,1,Negative ID,"I have Moroccan Mint that honey bees are all over entire summer. I went outside and saw this massive bee/hornet. It was on the mint, but then would also chase the other honey bees aggressively. After I took these pictures, another one showed up and they"
1682,1,Negative ID,Possible Asian giant? Would be good to know.
