,Label ID,Label,Notes
455,1,Negative ID,We spotted a Asian Giant Hornet on last Wednesday and saw it again in the same place today. We are Surveyors working on a project by the intersection of I5 and 300th St. near Stanwood Wa.  I’ll try and catch it tomorrow.  Hard to see in photo but we st
456,1,Negative ID,Second submission. Maybe slightly better photo
457,1,Negative ID,"Saw this on the side of the road, the entire thing was longer than my thumb. I was on my way to work and had nothing to collect it in, and it was covered in ants when I found it."
458,1,Negative ID,Unsure if this is one but it is much larger than the hornets that usually get trapped
459,1,Negative ID,Saw it flying and was able to knock it down. Several more were seen. We were by the city dumpsters when they were seen.
460,1,Negative ID,"Insect was sunning alone on deck. Attempted to trap, but flew away. Did not have a yellow/orange face. Think this may be a type of fly.  Approx 0.5-0.75 in long."
461,1,Negative ID,"The hornet was on the corner of a pool, and then flew away. We couldn’t hear it buzzing at all"
462,1,Negative ID,I found the tail and of this carcass in my driveway.  Not sure if its from a Giant Asian Hornet but its big.
463,1,Negative ID,Follow-up to report last night.  Was aggressive to person in our backyard.  Kept coming at her.  My cell is:  360-220-4387
464,1,Negative ID,This bug flew into our fire so it is rather charred. I have several photos and still have the bug body so I can take more photos or videos.
465,1,Negative ID, 
466,1,Negative ID, 
467,1,Negative ID,Found in hangar at Grant County Intl Airport. I bagged it if you want it
468,1,Negative ID,Found in my pool clean out basket.
469,1,Negative ID,"A wasp we have never seen at Ice Harbor dam. It doesn't quite look like the asian hornet, but we're not sure. Two long stingers on it. Or pigeon tail wasp?"
470,1,Negative ID,Crawling around in a flower pot
471,1,Negative ID,Found on porch near my door upside down
472,1,Negative ID,Local family found this and brought it to our EMS substation and were concerned.
473,1,Negative ID,Captured live in my yard while it was in grass. Was buzzing around prior. Believe it was attracted to water we had in kids water table for a few days. Will keep specimen until I hear from you. Likely to die overnight.
474,1,Negative ID,"saw two of these on our maple tree with a bad aphid issue that caused most leaves to be covered in ""honeydew"". probably over an inch long and more than twice the size of a wasp. not sure if thorax is black, but definitely orange face and orange  striped."
475,1,Negative ID,Largest I have ever seen. Believe we saw another a bit later but it flew away. Was by our pool deck. Over an inch long
476,1,Negative ID, 
477,1,Negative ID,I have it frozen in a jar. I was going to give it to WSU.
478,1,Negative ID,Found dead on deck. Don’t believe it’s the Asian hornet but I have never seen an insect like this before.
479,1,Negative ID,Noticed in Fraser hall at Western Washington University while cleaning the building. Maybe just over an inch long and had some dust on it meaning it probably had been dead for a bit. Didn't have the normal orange that most murder hornets do but had the f
480,1,Negative ID,"We have a dead carcus of a murder hornet. Head still moving. Body has been eaten by bird? wings, head, attenaes, and body skin still intact, just ""guts removed"" by something."
481,1,Negative ID,32nd and Gennessee in West Seattle 98126. There were 3 of them
482,1,Negative ID,"1 1/2 long, large body with yellow/brown stripes..  see attached picture - bottom pic is one from the internet so we could compare"
483,1,Negative ID,At Least 2.5 inches in length.
484,1,Negative ID,Single. On rocks. Slow moving.
485,1,Negative ID, 
486,1,Negative ID,"No known bee nests in area (trap in video is for deck purposes). Bug in video was hitting glass repeatedly, with loud clicking noise (not soft like moths make). Returned to area shortly after video was shot, repeated behavior. Video shot around 10:30pm,"
487,1,Negative ID, 
488,1,Negative ID,This bee was trying to sting horses on our property for several minutes before we caught it. It was very aggressive.
489,1,Negative ID,"Seen in Grapeview, WA postal code 98546. Not sure if an invasive Asian Hornet or something else. Possibly a pigeon tremulix? Has a long stinger. Maybe an inch long body, skinny. 2nd sighting of this kind of insect in the area."
490,1,Negative ID,"Wondering if it could be a young Asian hornet, it's being very aggressive towards the other bees in my garden actually physically fighting them."
491,1,Negative ID,"Found this wasp/hornet WAY larger than a normal wasp/hornet, a little less than 2"" long.    I should have tried to take a picture of it before killing it for easy identification.  Being so far inland I doubt it's an Asian wasp, but I am not qualified to"
492,1,Negative ID,Swatted bee out of air and have it in a jar
493,1,Negative ID,"They were coming out of a hole in the ground, and flying"
494,1,Negative ID, 
495,1,Negative ID,Found on patio
496,1,Negative ID,"Sitting by phantom lake. I think I’ve seen them earlier this week, but this was the first picture I’ve been able to get."
497,1,Negative ID, 
498,1,Negative ID,Lethargic and found on cement near people and pets
499,1,Negative ID,Saw this flying around my flower pot. A Yellowjacket was also flying around the same pot and was about half the size of the one in the pictures. Didn’t get a clear look at the head. Flew out of my yard heading East.
500,1,Negative ID,Saw this on my walk on the NE corner of Cedar Park Crescent and Redmond Ridge Dr in Redmond WA
501,1,Negative ID,10:45 AM
502,1,Negative ID,Landed next to us on the Magnuson soccer fields. I swatted w my flip flop.
503,1,Negative ID,found burrowing into grass
504,1,Negative ID,Have no idea as to what breed these are.  Did get stung and treated with liquid sting tube.
505,1,Negative ID,Next door in a house under construction.
506,1,Negative ID,Could not see it very well and did see a huge wasp back about a month ago before I know about these Hornets... so still not sure
507,1,Negative ID,"First seen near vegetable garden, entered garden then left through grass; approx. 2 inches long, definite orange head, dark brown thorax, see photo (cropped but not edited)"
508,1,Negative ID,"We have it trapped, but still alive."
509,1,Negative ID,foud at my house.
510,1,Negative ID, 
511,1,Negative ID,Seems a little falling apart and looks like it’s been dead a while. Can’t tell if it’s always been black or has darkened. Around 1” in length
512,1,Negative ID,"Found in my garden, killed with was spray. Is almost 2 inches long. Never seen anything like it before."
513,1,Negative ID,We saw a huge bee and were not sure if it was a murder hornet as we have never seen that big of a wasp/hornet/bee.  It was about and inch and a quarter to an inch and half long.  It was so mad when my husband was trying to kill it.  We were on a beach ac
514,1,Negative ID,"This thing was assaulting me as I was in my back yard, scared the hell out of me!"
515,1,Negative ID,"Port Angeles, WA"
516,1,Negative ID,I have it see video
517,1,Negative ID,Insect body measures one and a half inches in length.
518,1,Negative ID, 
519,1,Negative ID,"This picture taken at Hidden Lake above Lake Wenatchee.  I don't really think it's a murder hornet, not orange enough, too fuzzy.  Too windy to get a full on shot."
520,1,Negative ID,At the park
521,1,Negative ID,About 2 inches long when sprawled our
522,1,Negative ID,"Found insect just below edge of headlight upon returning to Colton,  Wa from Pullman,  Wa"
523,1,Negative ID,I have theses  Hornets on my property have seen about 12 this weekend
524,1,Negative ID,MY TREE IS FULL OF THEM!!!
525,1,Negative ID,Roughly 2 inches long
526,1,Negative ID,"It did not appear to be well. It was crawling very slowly on the ground. There was no sign of an external injury, but it could hardly move."
527,1,Negative ID,Saw two by the river and one in our backyard.
528,1,Negative ID,"Spent weekend in ocean shores and drove home to Buckley, wa. Found decreased on motor home while washing."
529,1,Negative ID,Very large and brown looking
530,1,Negative ID,Found this outside our front door / Kennewick WA
531,1,Negative ID,"Just a very large Wasp, I don't think it is a murder wasp.   But I am not an expert."
532,1,Negative ID,"Aggressive, chased out child whoPosed no thread. Sprayed with hornet/ wasp spray. We thought it was dead but later it was moving in the jar we sealed. We still have it- please advise if we can bring it somewhere!"
533,1,Negative ID,Key length is 5 cm
534,1,Negative ID,Reporting for another person. Local to me.
535,1,Negative ID,"attached my head, going after the back of my head.  it landed on the ground and i thumpped it."
536,1,Negative ID,It's dead on sidewalk by Discovery elementary school in Milton
537,1,Negative ID,I believe i saw one land on the flint stone next to me while i was sitting outside. I was on the phone so didn't get a picture
538,1,Negative ID,I’m not sure if this is the Asian hornet or Paper wasp but it was huge.
539,1,Negative ID,Saw one in my garden today. In Irondale wa.
540,1,Negative ID,Large bug/bee murder hornet found in Manson WA. We saved it in a box
541,1,Negative ID,"Found in parking lot of Trader Joe’s in Burien, WA"
542,1,Negative ID,Husband found it outside in our yard. We live on a ranch. It is roughly 1- 1 1/2 inches long.
543,1,Negative ID,"I think it might be a miner bee, but I have never seen anything like it before. I could only get a picture of the grand hole it made."
544,1,Negative ID,"solitary in my yard, wider body than any wasp I've seen"
545,1,Negative ID,"Not sure of this, but better safe than...."
546,1,Negative ID,Landed on a shed wall under construction.
547,1,Negative ID,The insect was found by my son's coworker.  The solitary insect was stepped on and kept.  I took some pictures of it and we also have the sample but would like to keep it if possible. It is approximately 1.25 inches long.  Wingspan is uncertain as they a
548,1,Negative ID,"Ants were eating out the shell of the hornet. The head and part of the end of the hornet were already gone, as were the wings and legs. Still, the length was nearly one inch, and the diameter roughly that of a No. 2 pencil. The markings on the main body"
549,1,Negative ID,Huge stinger
550,1,Negative ID,I saw this insect when I was out walking on a path- I thought it looked similar to a Murder Hornet so I wanted to let you know. I marked on the map the exact location.
551,1,Negative ID,"Was working outside and saw this huge thing fly and land next to me. I had bee spray nearby so I killed it because I’d never seen anything like it before, and I’ve lived out in the country for years."
552,1,Negative ID, 
553,1,Negative ID, 
554,1,Negative ID,"We saw 3 and managed to kill one, but no other sightings"
555,1,Negative ID,not bright in color but definitely much bigger than any other flying insect I have seen in my life
556,1,Negative ID, 
557,1,Negative ID,Large murder hornet or other bug found and killed
558,1,Negative ID,I saw a large wasp with a dammage wing.
559,1,Negative ID, 
560,1,Negative ID,"We used to have a ton of bees in the vegetable garden, but they disappeared a few weeks ago.  Don't know why.  Today I saw a huge wasp in the garden.  It was at least an inch long, in not longer.  I only saw it for a moment before it flew off, but it was"
561,1,Negative ID,big bee at least 2-3 inches almost all yellow with distinct black tail
562,1,Negative ID,"long body over an inch long, black body with a little yellow.  Not a massive head"
563,1,Negative ID,Not me driving. Sister car coming home from Connell Prison to Tri Cities
564,1,Negative ID, 
565,1,Negative ID,"Now that it's dead, pretty sure it's a Junebug"
566,1,Negative ID,Huge hornet in my house
567,1,Negative ID,"We were sitting on our outside porch and this hornet fell from above our covered porch. I immediately stood up and smashed it, since it started to aggressively fly around. I noticed the distinct orange color and haven’t one this big or this color aroun"
568,1,Negative ID, 
569,1,Negative ID,Extremely large body and stinger
570,1,Negative ID, 
571,1,Negative ID,I found this dismembered insect on the bow of my sailboat
572,1,Negative ID,"Photo is about 18"" above ground, 12"" away from insect."
573,1,Negative ID, 
574,1,Negative ID,"This is a large insect (2 inches?) with a dead bee in its grasp. Looks like the photo in today's Seattle Times (but not like the pictures on this website). This was outside our home in Newcastle, WA."
575,1,Negative ID,Don’t know what specie this is - yellow-faced
576,1,Negative ID,Prob not a kidder hornet- it is small maybe 3/4 inch long- thought it might be a juvenile? It just looked odd to me- took pics before I whacked it
577,1,Negative ID,this dropped into my sunroom while driving along the south shore of hood canal. it appeared stunned for 3 or 4 miles when i noticed it on my center console.
578,1,Negative ID, 
579,1,Negative ID,"This bee has a black head but all other characteristics look like the Asian Giant Bee. It's about 1"" and was hanging around our garbage can."
580,1,Negative ID,"We discovered a nest of wasps or bees unlike anything I have seen in our neighbor’s field behind our house. The neighbor lives in California and we walk the field and take care of the yard. This nest is unlike anything I’ve seen, but I did not want t"
581,1,Negative ID,Landed in the backyard of house that is close to a cherry orchard. Picture taken from about one foot away.
582,1,Negative ID, 
583,1,Negative ID,"2 inches long, in a wooded backyard. I have a video too if you want it. That’s where I took this still shot from."
584,1,Negative ID,Can you identify?   We looked it up and it seems to be a mason wasp?
585,1,Negative ID,"It was sitting on a fence I was repairing and I knocked it off the fence smashing his back end. I put a 2"" screw next to it when I took a picture"
586,1,Negative ID,"Ihave not seen this wasp, hornet  before but it likes Allum nectot"
587,1,Negative ID,No clue if this is the right thing.  But it says submit anyways.  Aslo it was found underground and it was cut in half with a shovel.
588,1,Negative ID, 
589,1,Negative ID,"Found this on front porch on a piece of furniture.  It was on it's back.  It measures 1 1/2"".  Should I put in a jar or just leave?"
590,1,Negative ID,"This specimen was laying on our sidewalk when I returned from a walk this morning. I think it may be a giant Asian hornet?  I have it in a jar, would you like me to save it so someone can check it out? Have you had any other sightings in the area?"
591,1,Negative ID,1-3/4 to 2 inches long
592,1,Negative ID,I know it does not have an orange head but it’s bigger than usual so I wanted to make sure.
593,1,Negative ID,"Found dead insect in parking lot of University Court Apartments 2102 N Walnut St Ellensburg, WA 98926"
594,1,Negative ID,Saw it struggling and I smashed after I took a picture
595,1,Negative ID,2+ inch wasp in my yard. I am used to all wasps and I’ve never seen anything like this before. It had a orange band up on the head but it was a dark orange
596,1,Negative ID,"I’m not sure if it is a Asian Hornet or not. It look about 1 1/2 inches long. This eyes are red, it has a darker shade of yellow-orange color. There’s gray fur on the thorax, but not completely brown."
597,1,Negative ID,Unusual buzzing heard; it was located in corner of sun porch in rural farm house.  It was about 1and 1/4 inch long.
598,1,Negative ID, 
599,1,Negative ID,"Seen in Tacoma, WA, near 15th st and North Cedar."
600,1,Negative ID,Spotted a few
601,1,Negative ID,Looks to be a dying Asian giant hornet
602,1,Negative ID,Lots of holes in ground...one or two of these flying around. This found dead.
603,1,Negative ID,"Flew into wet sand between our chairs just near waters edge, stayed there for a while, about an inch long maybe a little more. We buried it and can access the specimen if necessary."
604,1,Negative ID,Dead in my driveway
605,1,Negative ID,We found two today. In our front yard and back yard. Can you guys eradicate them. We have children at our home all the time.
606,1,Negative ID,"Was attacking our honeybees, significantly larger than all bees found in this area. Matches photos and description. TRAPPED TWO HORNETS alive, killed a third. varying in size but all around an american quarter circumference when rolled up. The photo belo"
607,1,Negative ID, 
608,1,Negative ID, 
609,1,Negative ID,Found live on the ground while weeding the garden
610,1,Negative ID,It was dead in my rabbits outside hutch and pen
611,1,Negative ID,Trapped this creature accidentally between my window screen and window.
612,1,Negative ID,Discovered dogs playing with it in the grass and stepped on it before they could be stung. It looked unlike any other bee or hornet I have ever seen around here.
613,1,Negative ID,I reported this yesterday but here are better pictures
614,1,Negative ID,Sun targets in Moxee
615,1,Negative ID,Found this guy dead in my grass. And have seen at least one other like it buzzing around today.
616,1,Negative ID,"It was laying by back sliding door, right in front of my doggie door. Was laying there, just barely moving. It had not been there in the morning when I watered."
617,1,Negative ID,"Flying pool side near condos in Lake Chelan, WA"
618,1,Negative ID,Found this alive on a railroad tie right by a bee nest.
619,1,Negative ID,"Not sure if this is a giant Asian Hornet, has long “stinger”?"
620,1,Negative ID,Bald faced hornet?
621,1,Negative ID,For in my pool
622,1,Negative ID,"We are in Umatilla National Forest, in a semi-wooded area"
623,1,Negative ID,I was under a pear tree in our yard and heard buzzing above then two massive Hornets fell out of the tree onto th ground and were like fighting or something and then tr hey flew away.
624,1,Negative ID,Flew in to veh SR14 in the Roosevelt area
625,1,Negative ID,It was laying still on the #15 green. I approached to move it (thought it was a beetle) until I moved my putter head close and it made a buzzing noise unlike anything I have heard from an insect.  So I stepped on it to kill it and we saved it in a plasti
626,1,Negative ID,Found in our washer which is in our garage as we were moving clothes from washer to the dryer.
627,1,Negative ID,This insect has been seen near our pool this summer about three times so far. Also we saw this same type of insect at our old home a street away about two years ago! The insect hovered and investigated the grass area near pool and finally settled near a
628,1,Negative ID,Asian Hornet??
629,1,Negative ID,Drowned in my cooler. It is soaking wet in picture.
630,1,Negative ID,"Doesn't look quite right, but was about 1"" or longer"
631,1,Negative ID,Was on our window.
632,1,Negative ID,This was on our window and kids are convinced we have Asian killer hornets.
633,1,Negative ID,We found two exoskeletons on scrub oak trees in Klickitat County that are larger than anything we have ever seen.
634,1,Negative ID,"Orange face with dark eyes, big stinger,"
635,1,Negative ID, 
636,1,Negative ID, 
637,1,Negative ID,"Not sure what this is, doesn’t look quite like your photos but we googled murder hornet and other photos more similar to this came up."
638,1,Negative ID,I was outside my balcony with the light on till I saw something flying to me and I quickly moved away and went inside my kitchen window
639,1,Negative ID,It was flying and sitting on my porch
640,1,Negative ID,"I have seen a lot of yellow jackets and wasps on the security cameras but nothing this big so I am reporting it just in case. The photos are not zoomed in and the camera is mounted up high, I thought at first this was a bird."
641,1,Negative ID,landed on friends dog big not aggressive  but killed it
642,1,Negative ID,"Beachview Park, Clarkston, Washington state"
643,1,Negative ID, 
644,1,Negative ID,Found floating in our swimming pool.  We do have honey bee hives and would like advice on what if anything we can do.
645,1,Negative ID,This was dead on our tent pad while camping.
646,1,Negative ID, 
647,1,Negative ID,First sighting was last night
648,1,Negative ID,Forgot add my email address. Wasp 1.5 inch long stuck in spider web. I didn’t dare get closer as it was still alive.
649,1,Negative ID,Got a photo. Reported earlier.
650,1,Negative ID,Found this guy on our street when I was walking my dogs in the morning. It was dead.
651,1,Negative ID,It was dead in our kiddie pool.
652,1,Negative ID,Caught it on our pool cover
653,1,Negative ID,I say a very large black flying insect that looked like a bee and went inside. When I can outside I saw a large insect that looked like a lighter colored bee with a missing head on my back deck barely moving and I have it in a container
654,1,Negative ID,Was in the house acting lethargic. Swatted with a fly swatter and it fell behind couch inside radiator. Waited for my husband to get him out of the radiator. So he is a little curled up and dry. He looked a lot bigger when it was hopping around on the wi
655,1,Negative ID, 
656,1,Negative ID, 
657,1,Negative ID, 
658,1,Negative ID,Is much bigger than other bees and dark brown/orange with yellow stripes.
659,1,Negative ID,"Not sure ,but it looks like one and the size is very close"
660,1,Negative ID,"Saw this large hornet (?) on my deck in Seattle. Not seen this insect before. It was about 1.25 inches in length. Looking on the internet, it most looked like  an European Hornet but I couldn't find info saying they were found on the west coast. We also"
661,1,Negative ID,"Found on a woodpile, probably not the Asian Hornet but wanted to report just in case"
662,1,Negative ID,In my front yard
663,1,Negative ID,The hornet landed on the windshield of my car as I was driving to work.  It hung on despite 35 mph conditions.  It then crawled under the hood of my car and I parked at work. I'm not sure if it's still under there.
664,1,Negative ID,Found on a trash can at the Clinton Washington ferry Terminal
665,1,Negative ID,We spotted this on a pool floaty Sunday afternoon. I am not sure if the picture shows it but it was at least two to two and 1/2 inches long. It was the largest bee any of us have ever seen!
666,1,Negative ID,It is not letting me download a picture. I will try again! Flower petals measured 2 inches.
667,1,Negative ID,Killed specimen and have saved it
668,1,Negative ID,Sitting on my deck. May have been lethargic.  Cut in half. Measured 1.5 inch.
669,1,Negative ID, 
670,1,Negative ID,"My family and I saw at least 4 hornets eating bees around our campsite. We camped at Third Beach in Forks, WA. They were found at the end of the trail head where the fresh water creek runs into the ocean. All surrounding the pile of drift wood."
671,1,Negative ID,"I'm not at all certain that this was an asian giant, but it was 1.5"" long and I cannot find a photo of a PNW wasp that matches up. Kinda freaked me out - please let me know if you know which this is. Photo was taken in 98136."
672,1,Negative ID, 
673,1,Negative ID,This big guy just tried to fly in my house in the north Seattle neighborhood of Wallingford.
674,1,Negative ID,"We found this at my work and had trapped it in between a window and screen. It was about 2"" long and had a big stinger stingers couple millimetres long, it also had Black and yellow stripes along its body."
675,1,Negative ID,"Location is Valleford, WA, on the corner of Spangle Creek Rd and Valley Chapel Rd. I saw this within the last month or two, maybe the photo indicates exact date. It was longer than it appears in this photo. It was not a bumble bee as this image makes it"
676,1,Negative ID,Headless body of large insect
677,1,Negative ID,Found  in pool
678,1,Negative ID, 
679,1,Negative ID,Just saw these asian hornets
680,1,Negative ID,Spotted in my backyard in Dupont.  Could only get an inflight picture.
681,1,Negative ID,Found our property in Walla Walla.
682,1,Negative ID,"Two bees landed on my screen appearing to be fighting. One was much larger than the other, about an inch long."
683,1,Negative ID,I've seen a murder hornet 3 times on my property in grapeview in the last month and have pictures of two bees with detached heads.
684,1,Negative ID,Flying around rhododendron. Seemed to be looking for flowers but there were none.
685,1,Negative ID,Dead in my pool filter 1.5 inches in length
686,1,Negative ID,"After looking at your photos, it’s probably the elm sawfly.  Sure looks like a bee."
687,1,Negative ID, 
688,1,Negative ID,"About an inch long, bold black and yellow stripes. Found it dead in swimming pool, have it in a jar now."
689,1,Negative ID,"I was seated in my front yard and something big flew close to me that got my attention. It landed on a leaf right there in front of my eyes. It was a huge wasp which was nor a simple one, it was the Asian Hornet. The picture I took is not helpful as I ha"
690,1,Negative ID,My family and I were camping at Sun Lakes State Park when we saw this huge bee (the picture doesn’t do the size justice) and I thought this has to be that murder hornet!
691,1,Negative ID,Found this in my kids swimming pool in the evening
692,1,Negative ID,Seen 2 of them trying to get water from my dogs water bowl. I killed one but the other one got away
693,1,Negative ID,About 1 inch long
694,1,Negative ID,Found dead doing yard work
695,1,Negative ID,Missing the head. Found it in the boat later that day
696,1,Negative ID,Found this nest. Looks large to me.
697,1,Negative ID,Found in vehicle grill
